{
  "id": "33333333-0000-4000-8000-000000000001",
  "type": "perception.perception",
  "perceiver_ref": {
    "type": "automation.smetion",
    "id": "22222222-0000-4000-8000-000000000010",
    "canonical_key": "smetion.assetsInteractor.blackbox",
    "name": "assetsInteractor black-box smetion"
  },
  "source_refs": [
    {
      "type": "telemetry.vulnerability_finding",
      "id": "finding.assetsInteractor.blackbox.20260512.001",
      "canonical_key": "finding.assetsInteractor.blackbox.20260512.001",
      "name": "Black-box TLS endpoint vulnerability finding"
    },
    {
      "type": "telemetry.interaction_result",
      "id": "interaction.assetsInteractor.blackbox.20260512.001",
      "canonical_key": "interaction.assetsInteractor.blackbox.20260512.001",
      "name": "Black-box HTTPS probe result"
    }
  ],
  "use_case_ref": {
    "type": "operation.use_case",
    "id": "11111111-0000-4000-8000-000000000002",
    "canonical_key": "technical_security.penetration_testing_vulnerability_management.end_to_end",
    "name": "End-to-end penetration testing and technical vulnerability management"
  },
  "smetion_ref": {
    "type": "automation.smetion",
    "id": "22222222-0000-4000-8000-000000000010",
    "canonical_key": "smetion.assetsInteractor.blackbox",
    "name": "assetsInteractor black-box smetion"
  },
  "perception_type": "perception.vulnerability_detected",
  "summary": "Black-box interaction identified an internet-facing HTTPS endpoint with a scanner-confirmed vulnerability and sufficient evidence to propose an assurance finding and candidate relative risk group.",
  "confidence": 0.86,
  "claims": [
    {
      "claim_type": "claim.affected_asset",
      "subject_ref": {
        "type": "asset.external_endpoint",
        "id": "asset.endpoint.customer_portal_https",
        "canonical_key": "asset.endpoint.customer_portal_https",
        "name": "Customer portal HTTPS endpoint"
      },
      "predicate": "has_vulnerability",
      "object_ref": {
        "type": "risk.vulnerability",
        "id": "vulnerability.tls_weak_configuration.customer_portal",
        "canonical_key": "vulnerability.tls_weak_configuration.customer_portal",
        "name": "Customer portal TLS weak configuration"
      },
      "confidence": 0.86,
      "evidence_refs": [
        {
          "type": "evidence.record",
          "id": "evidence.assetsInteractor.blackbox.20260512.001",
          "canonical_key": "evidence.assetsInteractor.blackbox.20260512.001",
          "name": "Black-box scan evidence"
        }
      ]
    },
    {
      "claim_type": "claim.severity",
      "subject_ref": {
        "type": "risk.vulnerability",
        "id": "vulnerability.tls_weak_configuration.customer_portal",
        "canonical_key": "vulnerability.tls_weak_configuration.customer_portal",
        "name": "Customer portal TLS weak configuration"
      },
      "predicate": "has_severity",
      "value": "high",
      "confidence": 0.82
    },
    {
      "claim_type": "claim.scope_authorisation",
      "subject_ref": {
        "type": "telemetry.interaction_result",
        "id": "interaction.assetsInteractor.blackbox.20260512.001",
        "canonical_key": "interaction.assetsInteractor.blackbox.20260512.001",
        "name": "Black-box HTTPS probe result"
      },
      "predicate": "within_authorised_scope",
      "object_ref": {
        "type": "operation.scope",
        "id": "scope.customer_portal_external_assessment.2026q2",
        "canonical_key": "scope.customer_portal_external_assessment.2026q2",
        "name": "Customer portal external assessment scope"
      },
      "confidence": 0.95
    }
  ],
  "candidate_relationships": [
    {
      "relationship_type": "exposes",
      "source_ref": {
        "type": "asset.application",
        "id": "asset.application.customer_portal",
        "canonical_key": "asset.application.customer_portal",
        "name": "Customer portal"
      },
      "target_ref": {
        "type": "asset.external_endpoint",
        "id": "asset.endpoint.customer_portal_https",
        "canonical_key": "asset.endpoint.customer_portal_https",
        "name": "Customer portal HTTPS endpoint"
      },
      "confidence": 0.9
    },
    {
      "relationship_type": "evidences",
      "source_ref": {
        "type": "evidence.record",
        "id": "evidence.assetsInteractor.blackbox.20260512.001",
        "canonical_key": "evidence.assetsInteractor.blackbox.20260512.001",
        "name": "Black-box scan evidence"
      },
      "target_ref": {
        "type": "risk.vulnerability",
        "id": "vulnerability.tls_weak_configuration.customer_portal",
        "canonical_key": "vulnerability.tls_weak_configuration.customer_portal",
        "name": "Customer portal TLS weak configuration"
      },
      "confidence": 0.86
    }
  ],
  "recommended_commands": [
    "schema.command.create_finding",
    "schema.command.propose_risk",
    "schema.command.propose_relative_risk_group",
    "schema.command.request_human_approval"
  ],
  "status": "candidate",
  "validation_refs": [
    {
      "type": "schema.validation_result",
      "id": "validation.perception.vulnerability.20260512.001",
      "canonical_key": "validation.perception.vulnerability.20260512.001",
      "name": "Vulnerability perception validation"
    }
  ],
  "observed_at": "2026-05-12T00:30:00Z"
}
